{
  "schema_version": "1.0.0",
  "declared_independent_unit": "experimental_run",
  "primitive_sampling_proportions": [
    0.3333333333333333,
    0.3333333333333333,
    0.3333333333333333
  ],
  "feature_contract": {
    "feature_schema_sha256": "aaaaaaaaaaaaaaaaaaaaaaaaaaaaaaaaaaaaaaaaaaaaaaaaaaaaaaaaaaaaaaaa",
    "feature_transform_sha256": "bbbbbbbbbbbbbbbbbbbbbbbbbbbbbbbbbbbbbbbbbbbbbbbbbbbbbbbbbbbbbbbb"
  },
  "config": {
    "seed": 41,
    "n_folds": 2,
    "fit": {
      "n_classes": 3,
      "l2_penalty": 0.1,
      "max_iterations": 20000,
      "gradient_tolerance": 0.0000001,
      "initial_step": 1.0
    }
  },
  "samples": [
    {"features": [0.0], "arm": "baseline", "cluster_id": "baseline-0"},
    {"features": [0.0], "arm": "baseline", "cluster_id": "baseline-1"},
    {"features": [0.0], "arm": "first", "cluster_id": "first-0"},
    {"features": [0.0], "arm": "first", "cluster_id": "first-1"},
    {"features": [0.0], "arm": "second", "cluster_id": "second-0"},
    {"features": [0.0], "arm": "second", "cluster_id": "second-1"}
  ]
}
